<?xml version="1.0" encoding="UTF-8"?>
<!DOCTYPE biblioteca [
  <!ELEMENT biblioteca (libro+)>
  <!ATTLIST libro id ID #REQUIRED>
  <!ELEMENT libro (titulo,autor,año)>
  <!ELEMENT titulo (#PCDATA)>
  <!ELEMENT autor (#PCDATA)>
  <!ELEMENT año (#PCDATA)>
]>
<biblioteca>
  <libro id="L001">
    <titulo>El Gran Gatsby</titulo>
    <autor>F. Scott Fitzgerald</autor>
    <año>1925</año>
  </libro>
  <libro id="L002">
    <titulo>Cien Años de Soledad</titulo>
    <autor>Gabriel García Márquez</autor>
    <año>1967</año>
  </libro>
  <!-- Agrega más libros aquí -->
</biblioteca>
